{
  "$schema": "../../schema/sound-pack.schema.json",
  "id": "interface-sounds",
  "name": "Interface Sounds",
  "source": "kenney",
  "license": "CC0",
  "homepage": "https://kenney.nl/assets/interface-sounds",
  "downloadUrl": "https://kenney.nl/media/pages/assets/interface-sounds/d23a84242e-1677589452/kenney_interface-sounds.zip",
  "sounds": {
    "back-001": { "file": "Audio/back_001.ogg", "category": "sfx" },
    "back-002": { "file": "Audio/back_002.ogg", "category": "sfx" },
    "back-003": { "file": "Audio/back_003.ogg", "category": "sfx" },
    "back-004": { "file": "Audio/back_004.ogg", "category": "sfx" },
    "bong-001": { "file": "Audio/bong_001.ogg", "category": "sfx" },
    "click-001": { "file": "Audio/click_001.ogg", "category": "sfx" },
    "click-002": { "file": "Audio/click_002.ogg", "category": "sfx" },
    "click-003": { "file": "Audio/click_003.ogg", "category": "sfx" },
    "click-004": { "file": "Audio/click_004.ogg", "category": "sfx" },
    "click-005": { "file": "Audio/click_005.ogg", "category": "sfx" },
    "close-001": { "file": "Audio/close_001.ogg", "category": "sfx" },
    "close-002": { "file": "Audio/close_002.ogg", "category": "sfx" },
    "close-003": { "file": "Audio/close_003.ogg", "category": "sfx" },
    "close-004": { "file": "Audio/close_004.ogg", "category": "sfx" },
    "confirmation-001": { "file": "Audio/confirmation_001.ogg", "category": "sfx" },
    "confirmation-002": { "file": "Audio/confirmation_002.ogg", "category": "sfx" },
    "confirmation-003": { "file": "Audio/confirmation_003.ogg", "category": "sfx" },
    "confirmation-004": { "file": "Audio/confirmation_004.ogg", "category": "sfx" },
    "drop-001": { "file": "Audio/drop_001.ogg", "category": "sfx" },
    "drop-002": { "file": "Audio/drop_002.ogg", "category": "sfx" },
    "drop-003": { "file": "Audio/drop_003.ogg", "category": "sfx" },
    "drop-004": { "file": "Audio/drop_004.ogg", "category": "sfx" },
    "error-001": { "file": "Audio/error_001.ogg", "category": "sfx" },
    "error-002": { "file": "Audio/error_002.ogg", "category": "sfx" },
    "error-003": { "file": "Audio/error_003.ogg", "category": "sfx" },
    "error-004": { "file": "Audio/error_004.ogg", "category": "sfx" },
    "error-005": { "file": "Audio/error_005.ogg", "category": "sfx" },
    "error-006": { "file": "Audio/error_006.ogg", "category": "sfx" },
    "error-007": { "file": "Audio/error_007.ogg", "category": "sfx" },
    "error-008": { "file": "Audio/error_008.ogg", "category": "sfx" },
    "glass-001": { "file": "Audio/glass_001.ogg", "category": "sfx" },
    "glass-002": { "file": "Audio/glass_002.ogg", "category": "sfx" },
    "glass-003": { "file": "Audio/glass_003.ogg", "category": "sfx" },
    "glass-004": { "file": "Audio/glass_004.ogg", "category": "sfx" },
    "glass-005": { "file": "Audio/glass_005.ogg", "category": "sfx" },
    "glass-006": { "file": "Audio/glass_006.ogg", "category": "sfx" },
    "glitch-001": { "file": "Audio/glitch_001.ogg", "category": "sfx" },
    "glitch-002": { "file": "Audio/glitch_002.ogg", "category": "sfx" },
    "glitch-003": { "file": "Audio/glitch_003.ogg", "category": "sfx" },
    "glitch-004": { "file": "Audio/glitch_004.ogg", "category": "sfx" },
    "maximize-001": { "file": "Audio/maximize_001.ogg", "category": "sfx" },
    "maximize-002": { "file": "Audio/maximize_002.ogg", "category": "sfx" },
    "maximize-003": { "file": "Audio/maximize_003.ogg", "category": "sfx" },
    "maximize-004": { "file": "Audio/maximize_004.ogg", "category": "sfx" },
    "maximize-005": { "file": "Audio/maximize_005.ogg", "category": "sfx" },
    "maximize-006": { "file": "Audio/maximize_006.ogg", "category": "sfx" },
    "maximize-007": { "file": "Audio/maximize_007.ogg", "category": "sfx" },
    "maximize-008": { "file": "Audio/maximize_008.ogg", "category": "sfx" },
    "maximize-009": { "file": "Audio/maximize_009.ogg", "category": "sfx" },
    "minimize-001": { "file": "Audio/minimize_001.ogg", "category": "sfx" },
    "minimize-002": { "file": "Audio/minimize_002.ogg", "category": "sfx" },
    "minimize-003": { "file": "Audio/minimize_003.ogg", "category": "sfx" },
    "minimize-004": { "file": "Audio/minimize_004.ogg", "category": "sfx" },
    "minimize-005": { "file": "Audio/minimize_005.ogg", "category": "sfx" },
    "minimize-006": { "file": "Audio/minimize_006.ogg", "category": "sfx" },
    "minimize-007": { "file": "Audio/minimize_007.ogg", "category": "sfx" },
    "minimize-008": { "file": "Audio/minimize_008.ogg", "category": "sfx" },
    "minimize-009": { "file": "Audio/minimize_009.ogg", "category": "sfx" },
    "open-001": { "file": "Audio/open_001.ogg", "category": "sfx" },
    "open-002": { "file": "Audio/open_002.ogg", "category": "sfx" },
    "open-003": { "file": "Audio/open_003.ogg", "category": "sfx" },
    "open-004": { "file": "Audio/open_004.ogg", "category": "sfx" },
    "pluck-001": { "file": "Audio/pluck_001.ogg", "category": "sfx" },
    "pluck-002": { "file": "Audio/pluck_002.ogg", "category": "sfx" },
    "question-001": { "file": "Audio/question_001.ogg", "category": "sfx" },
    "question-002": { "file": "Audio/question_002.ogg", "category": "sfx" },
    "question-003": { "file": "Audio/question_003.ogg", "category": "sfx" },
    "question-004": { "file": "Audio/question_004.ogg", "category": "sfx" },
    "scratch-001": { "file": "Audio/scratch_001.ogg", "category": "sfx" },
    "scratch-002": { "file": "Audio/scratch_002.ogg", "category": "sfx" },
    "scratch-003": { "file": "Audio/scratch_003.ogg", "category": "sfx" },
    "scratch-004": { "file": "Audio/scratch_004.ogg", "category": "sfx" },
    "scratch-005": { "file": "Audio/scratch_005.ogg", "category": "sfx" },
    "scroll-001": { "file": "Audio/scroll_001.ogg", "category": "sfx" },
    "scroll-002": { "file": "Audio/scroll_002.ogg", "category": "sfx" },
    "scroll-003": { "file": "Audio/scroll_003.ogg", "category": "sfx" },
    "scroll-004": { "file": "Audio/scroll_004.ogg", "category": "sfx" },
    "scroll-005": { "file": "Audio/scroll_005.ogg", "category": "sfx" },
    "select-001": { "file": "Audio/select_001.ogg", "category": "sfx" },
    "select-002": { "file": "Audio/select_002.ogg", "category": "sfx" },
    "select-003": { "file": "Audio/select_003.ogg", "category": "sfx" },
    "select-004": { "file": "Audio/select_004.ogg", "category": "sfx" },
    "select-005": { "file": "Audio/select_005.ogg", "category": "sfx" },
    "select-006": { "file": "Audio/select_006.ogg", "category": "sfx" },
    "select-007": { "file": "Audio/select_007.ogg", "category": "sfx" },
    "select-008": { "file": "Audio/select_008.ogg", "category": "sfx" },
    "switch-001": { "file": "Audio/switch_001.ogg", "category": "sfx" },
    "switch-002": { "file": "Audio/switch_002.ogg", "category": "sfx" },
    "switch-003": { "file": "Audio/switch_003.ogg", "category": "sfx" },
    "switch-004": { "file": "Audio/switch_004.ogg", "category": "sfx" },
    "switch-005": { "file": "Audio/switch_005.ogg", "category": "sfx" },
    "switch-006": { "file": "Audio/switch_006.ogg", "category": "sfx" },
    "switch-007": { "file": "Audio/switch_007.ogg", "category": "sfx" },
    "tick-001": { "file": "Audio/tick_001.ogg", "category": "sfx" },
    "tick-002": { "file": "Audio/tick_002.ogg", "category": "sfx" },
    "tick-004": { "file": "Audio/tick_004.ogg", "category": "sfx" },
    "toggle-001": { "file": "Audio/toggle_001.ogg", "category": "sfx" },
    "toggle-002": { "file": "Audio/toggle_002.ogg", "category": "sfx" },
    "toggle-003": { "file": "Audio/toggle_003.ogg", "category": "sfx" },
    "toggle-004": { "file": "Audio/toggle_004.ogg", "category": "sfx" }
  },
  "tags": {
    "navigation": [
      "back-001", "back-002", "back-003", "back-004",
      "scroll-001", "scroll-002", "scroll-003", "scroll-004", "scroll-005"
    ],
    "click": [
      "click-001", "click-002", "click-003", "click-004", "click-005",
      "tick-001", "tick-002", "tick-004"
    ],
    "selection": [
      "select-001", "select-002", "select-003", "select-004",
      "select-005", "select-006", "select-007", "select-008"
    ],
    "confirmation": [
      "confirmation-001", "confirmation-002", "confirmation-003", "confirmation-004",
      "bong-001"
    ],
    "error": [
      "error-001", "error-002", "error-003", "error-004",
      "error-005", "error-006", "error-007", "error-008"
    ],
    "dialog": [
      "open-001", "open-002", "open-003", "open-004",
      "close-001", "close-002", "close-003", "close-004"
    ],
    "window": [
      "maximize-001", "maximize-002", "maximize-003", "maximize-004", "maximize-005",
      "maximize-006", "maximize-007", "maximize-008", "maximize-009",
      "minimize-001", "minimize-002", "minimize-003", "minimize-004", "minimize-005",
      "minimize-006", "minimize-007", "minimize-008", "minimize-009"
    ],
    "toggle": [
      "toggle-001", "toggle-002", "toggle-003", "toggle-004",
      "switch-001", "switch-002", "switch-003", "switch-004",
      "switch-005", "switch-006", "switch-007"
    ],
    "drag-drop": [
      "drop-001", "drop-002", "drop-003", "drop-004"
    ],
    "notification": [
      "question-001", "question-002", "question-003", "question-004",
      "glass-001", "glass-002", "glass-003", "glass-004", "glass-005", "glass-006",
      "pluck-001", "pluck-002"
    ],
    "effect": [
      "glitch-001", "glitch-002", "glitch-003", "glitch-004",
      "scratch-001", "scratch-002", "scratch-003", "scratch-004", "scratch-005"
    ]
  },
  "metadata": {
    "author": "Kenney",
    "description": "100 interface/UI sound effects for game menus, buttons, toggles, and window interactions",
    "totalSounds": 100
  }
}
